<?xml version="1.0" encoding="UTF-8"?>
<conciertos xmlns:xsi="http://www.w3.org/2001/XMLSchema-instance"
    xsi:noNamespaceSchemaLocation="registros.xsd">
    <!-- K-POP -->
    <artista>
        <nombre>BTS</nombre>
        <genero>K-pop</genero>
        <miembros>7</miembros>
        <fecha_concierto>2025-01-01</fecha_concierto>
        <pais>Corea del Sur</pais>
    </artista>
    <artista>
        <nombre>BLACKPINK</nombre>
        <genero>K-pop</genero>
        <miembros>4</miembros>
        <fecha_concierto>2025-01-02</fecha_concierto>
        <pais>Corea del Sur</pais>
    </artista>
    <artista>
        <nombre>BLACKPINK</nombre>
        <genero>K-pop</genero>
        <miembros>4</miembros>
        <fecha_concierto>2025-01-03</fecha_concierto>
        <pais>Corea del Sur</pais>
    </artista>
    <artista>
        <nombre>EXO</nombre>
        <genero>K-pop</genero>
        <miembros>9</miembros>
        <fecha_concierto>2025-01-04</fecha_concierto>
        <pais>Corea del Sur</pais>
    </artista>
    <artista>
        <nombre>TWICE</nombre>
        <genero>K-pop</genero>
        <miembros>9</miembros>
        <fecha_concierto>2025-01-05</fecha_concierto>
        <pais>Corea del Sur</pais>
    </artista>
    <artista>
        <nombre>SEVENTEEN</nombre>
        <genero>K-pop</genero>
        <miembros>13</miembros>
        <fecha_concierto>2025-01-06</fecha_concierto>
        <pais>Corea del Sur</pais>
    </artista>
    <artista>
        <nombre>Stray Kids</nombre>
        <genero>K-pop</genero>
        <miembros>8</miembros>
        <fecha_concierto>2025-01-07</fecha_concierto>
        <pais>Corea del Sur</pais>
    </artista>
    <artista>
        <nombre>NCT 127</nombre>
        <genero>K-pop</genero>
        <miembros>10</miembros>
        <fecha_concierto>2025-01-08</fecha_concierto>
        <pais>Corea del Sur</pais>
    </artista>
    <artista>
        <nombre>NCT Dream</nombre>
        <genero>K-pop</genero>
        <miembros>7</miembros>
        <fecha_concierto>2025-01-09</fecha_concierto>
        <pais>Corea del Sur</pais>
    </artista>
    <artista>
        <nombre>WayV</nombre>
        <genero>K-pop</genero>
        <miembros>7</miembros>
        <fecha_concierto>2025-01-10</fecha_concierto>
        <pais>China</pais>
    </artista>
    <artista>
        <nombre>ITZY</nombre>
        <genero>K-pop</genero>
        <miembros>5</miembros>
        <fecha_concierto>2025-01-11</fecha_concierto>
        <pais>Corea del Sur</pais>
    </artista>
    <artista>
        <nombre>TXT (TOMORROW X TOGETHER)</nombre>
        <genero>K-pop</genero>
        <miembros>5</miembros>
        <fecha_concierto>2025-01-12</fecha_concierto>
        <pais>Corea del Sur</pais>
    </artista>
    <artista>
        <nombre>ATEEZ</nombre>
        <genero>K-pop</genero>
        <miembros>8</miembros>
        <fecha_concierto>2025-01-13</fecha_concierto>
        <pais>Corea del Sur</pais>
    </artista>
    <artista>
        <nombre>ENHYPEN</nombre>
        <genero>K-pop</genero>
        <miembros>7</miembros>
        <fecha_concierto>2025-01-14</fecha_concierto>
        <pais>Corea del Sur</pais>
    </artista>
    <artista>
        <nombre>Red Velvet</nombre>
        <genero>K-pop</genero>
        <miembros>5</miembros>
        <fecha_concierto>2025-01-15</fecha_concierto>
        <pais>Corea del Sur</pais>
    </artista>
    <artista>
        <nombre>NewJeans</nombre>
        <genero>K-pop</genero>
        <miembros>5</miembros>
        <fecha_concierto>2025-01-16</fecha_concierto>
        <pais>Corea del Sur</pais>
    </artista>
    <artista>
        <nombre>LE SSERAFIM</nombre>
        <genero>K-pop</genero>
        <miembros>6</miembros>
        <fecha_concierto>2025-01-17</fecha_concierto>
        <pais>Corea del Sur</pais>
    </artista>
    <artista>
        <nombre>IVE</nombre>
        <genero>K-pop</genero>
        <miembros>6</miembros>
        <fecha_concierto>2025-01-18</fecha_concierto>
        <pais>Corea del Sur</pais>
    </artista>
    <artista>
        <nombre>(G)I-DLE</nombre>
        <genero>K-pop</genero>
        <miembros>6</miembros>
        <fecha_concierto>2025-01-19</fecha_concierto>
        <pais>Corea del Sur</pais>
    </artista>
    <artista>
        <nombre>STAYC</nombre>
        <genero>K-pop</genero>
        <miembros>6</miembros>
        <fecha_concierto>2025-01-20</fecha_concierto>
        <pais>Corea del Sur</pais>
    </artista>
    <artista>
        <nombre>SHINee</nombre>
        <genero>K-pop</genero>
        <miembros>5</miembros>
        <fecha_concierto>2025-01-21</fecha_concierto>
        <pais>Corea del Sur</pais>
    </artista>

    <!-- RAP / HIP HOP -->
    <artista>
        <nombre>Travis Scott</nombre>
        <genero>Rap / Hip-Hop</genero>
        <miembros>1</miembros>
        <fecha_concierto>2025-01-22</fecha_concierto>
        <pais>USA</pais>
    </artista>
    <artista>
        <nombre>Kendrick Lamar</nombre>
        <genero>Rap / Hip-Hop</genero>
        <miembros>1</miembros>
        <fecha_concierto>2025-01-23</fecha_concierto>
        <pais>USA</pais>
    </artista>
    <artista>
        <nombre>Drake</nombre>
        <genero>Rap / Hip-Hop</genero>
        <miembros>1</miembros>
        <fecha_concierto>2025-01-24</fecha_concierto>
        <pais>Canadá</pais>
    </artista>
    <artista>
        <nombre>J. Cole</nombre>
        <genero>Rap / Hip-Hop</genero>
        <miembros>1</miembros>
        <fecha_concierto>2025-01-25</fecha_concierto>
        <pais>USA</pais>
    </artista>
    <artista>
        <nombre>The Weeknd</nombre>
        <genero>Rap / Hip-Hop</genero>
        <miembros>1</miembros>
        <fecha_concierto>2025-01-26</fecha_concierto>
        <pais>Canadá</pais>
    </artista>
    <artista>
        <nombre>Future</nombre>
        <genero>Rap / Hip-Hop</genero>
        <miembros>1</miembros>
        <fecha_concierto>2025-01-27</fecha_concierto>
        <pais>USA</pais>
    </artista>
    <artista>
        <nombre>Lil Uzi Vert</nombre>
        <genero>Rap / Hip-Hop</genero>
        <miembros>1</miembros>
        <fecha_concierto>2025-01-28</fecha_concierto>
        <pais>USA</pais>
    </artista>
    <artista>
        <nombre>21 Savage</nombre>
        <genero>Rap / Hip-Hop</genero>
        <miembros>1</miembros>
        <fecha_concierto>2025-01-29</fecha_concierto>
        <pais>USA</pais>
    </artista>
    <artista>
        <nombre>Playboi Carti</nombre>
        <genero>Rap / Hip-Hop</genero>
        <miembros>1</miembros>
        <fecha_concierto>2025-01-30</fecha_concierto>
        <pais>USA</pais>
    </artista>
    <artista>
        <nombre>Lil Baby</nombre>
        <genero>Rap / Hip-Hop</genero>
        <miembros>1</miembros>
        <fecha_concierto>2025-01-31</fecha_concierto>
        <pais>USA</pais>
    </artista>
    <artista>
        <nombre>Gunna</nombre>
        <genero>Rap / Hip-Hop</genero>
        <miembros>1</miembros>
        <fecha_concierto>2025-02-01</fecha_concierto>
        <pais>USA</pais>
    </artista>
    <artista>
        <nombre>Metro Boomin</nombre>
        <genero>Rap / Hip-Hop</genero>
        <miembros>1</miembros>
        <fecha_concierto>2025-02-02</fecha_concierto>
        <pais>USA</pais>
    </artista>
    <artista>
        <nombre>A$AP Rocky</nombre>
        <genero>Rap / Hip-Hop</genero>
        <miembros>1</miembros>
        <fecha_concierto>2025-02-03</fecha_concierto>
        <pais>USA</pais>
    </artista>
    <artista>
        <nombre>Kanye West</nombre>
        <genero>Rap / Hip-Hop</genero>
        <miembros>1</miembros>
        <fecha_concierto>2025-02-04</fecha_concierto>
        <pais>USA</pais>
    </artista>
    <artista>
        <nombre>Kid Cudi</nombre>
        <genero>Rap / Hip-Hop</genero>
        <miembros>1</miembros>
        <fecha_concierto>2025-02-05</fecha_concierto>
        <pais>USA</pais>
    </artista>
    <artista>
        <nombre>Pusha T</nombre>
        <genero>Rap / Hip-Hop</genero>
        <miembros>1</miembros>
        <fecha_concierto>2025-02-06</fecha_concierto>
        <pais>USA</pais>
    </artista>
    <artista>
        <nombre>Meek Mill</nombre>
        <genero>Rap / Hip-Hop</genero>
        <miembros>1</miembros>
        <fecha_concierto>2025-02-07</fecha_concierto>
        <pais>USA</pais>
    </artista>
    <artista>
        <nombre>Cardi B</nombre>
        <genero>Rap / Hip-Hop</genero>
        <miembros>1</miembros>
        <fecha_concierto>2025-02-08</fecha_concierto>
        <pais>USA</pais>
    </artista>
    <artista>
        <nombre>Nicki Minaj</nombre>
        <genero>Rap / Hip-Hop</genero>
        <miembros>1</miembros>
        <fecha_concierto>2025-02-09</fecha_concierto>
        <pais>Trinidad y Tobago</pais>
    </artista>
    <artista>
        <nombre>Ice Spice</nombre>
        <genero>Rap / Hip-Hop</genero>
        <miembros>1</miembros>
        <fecha_concierto>2025-02-10</fecha_concierto>
        <pais>USA</pais>
    </artista>

    <!-- M. MEXICANA -->
    <artista>
        <nombre>Peso Pluma</nombre>
        <genero>Música Mexicana</genero>
        <miembros>1</miembros>
        <fecha_concierto>2025-02-11</fecha_concierto>
        <pais>México</pais>
    </artista>
    <artista>
        <nombre>Natanael Cano</nombre>
        <genero>Música Mexicana</genero>
        <miembros>1</miembros>
        <fecha_concierto>2025-02-12</fecha_concierto>
        <pais>México</pais>
    </artista>
    <artista>
        <nombre>Fuerza Regida</nombre>
        <genero>Música Mexicana</genero>
        <miembros>5</miembros>
        <fecha_concierto>2025-02-13</fecha_concierto>
        <pais>México</pais>
    </artista>
    <artista>
        <nombre>Junior H</nombre>
        <genero>Música Mexicana</genero>
        <miembros>1</miembros>
        <fecha_concierto>2025-02-14</fecha_concierto>
        <pais>México</pais>
    </artista>
    <artista>
        <nombre>Christian Nodal</nombre>
        <genero>Música Mexicana</genero>
        <miembros>1</miembros>